{
  "schema": "tnims-type-inventory/v1",
  "unit": "S01-approach",
  "source_psb": "D:/Hermes/projects/The-Night-I-Met-Santa/Xtraz/Adobe-Photoshop/FINAL-Master-PSDs/TNIMS-Book-Master-FINAL.psb",
  "canvas_px": [
    5250,
    2625
  ],
  "dpi": 300.0,
  "bleed_in": 0.125,
  "exported_at": "2026-08-03T11:21:00Z",
  "frames": [
    {
      "id": "S01-approach-right-01",
      "unit": "S01-approach",
      "group": "S01",
      "ps_layer": "I got up the nerve to go to the door, a door that was decorated",
      "page": "right",
      "visible": true,
      "opacity": 255.0,
      "bbox_px": {
        "l": 848.0,
        "t": 1558,
        "r": 1721.0,
        "b": 1928
      },
      "bbox_spread_px": [
        3473,
        1558,
        4346,
        1928
      ],
      "bbox_page_px": [
        848.0,
        1558,
        1721.0,
        1928
      ],
      "bounds_in": {
        "top": 5.0683,
        "left": 2.7017,
        "bottom": 6.3017,
        "right": 5.6117
      },
      "font": "'CormorantGaramond-Medium'",
      "style": "Regular",
      "size_pt": 20.0,
      "leading_pt": 23.0,
      "tracking": 12.0,
      "color": "#FFFFFB",
      "align": "center",
      "space_before_pt": 0,
      "space_after_pt": 8,
      "paragraph_style": "Poem-Body",
      "text": "I got up the nerve\nto go to the door,\na door that was decorated, bolted and locked.",
      "runs": [],
      "faux_bold": false,
      "scale_x": 1.0,
      "scale_y": 1.0,
      "size_raw": 83.33334,
      "leading_raw": 95.83334
    },
    {
      "id": "S01-approach-left-02",
      "unit": "S01-approach",
      "group": "S01",
      "ps_layer": "I searched and I peeked when I first heard the noise.    Someth",
      "page": "left",
      "visible": true,
      "opacity": 255.0,
      "bbox_px": {
        "l": 280,
        "t": 263,
        "r": 1310,
        "b": 1244
      },
      "bbox_spread_px": [
        280,
        263,
        1310,
        1244
      ],
      "bbox_page_px": [
        280,
        263,
        1310,
        1244
      ],
      "bounds_in": {
        "top": 0.7517,
        "left": 0.8083,
        "bottom": 4.0217,
        "right": 4.2417
      },
      "font": "'CormorantGaramond-Medium'",
      "style": "Regular",
      "size_pt": 20.0,
      "leading_pt": 23.0,
      "tracking": 12.0,
      "color": "#FFFFFB",
      "align": "center",
      "space_before_pt": 0,
      "space_after_pt": 8,
      "paragraph_style": "Poem-Body",
      "text": "I searched and I peeked when I first heard the noise.\n\nSomething or someone was in with the toys.\n\nI slithered and crawled for a peek of a glimpse.\n\nIt must be some fairies or holiday imps.",
      "runs": [],
      "faux_bold": false,
      "scale_x": 1.0,
      "scale_y": 1.0,
      "size_raw": 83.33334,
      "leading_raw": 95.83334
    }
  ],
  "notes": "Generated by scripts/export_type_inventory_from_psb.py"
}